{
  "dcp_version": "2.0",
  "violation_id": "violation:mem-tamper-2026-003",
  "session_nonce": "a1b2c3d4e5f6a1b2c3d4e5f6a1b2c3d4e5f6a1b2c3d4e5f6a1b2c3d4e5f6a1b2",
  "agent_id": "agent:research-bot-v2-001",
  "violated_right": "memory_integrity",
  "evidence_hashes": [
    "deadbeef01020304050607080910deadbeef01020304050607080910deadbeef01",
    "cafebabe01020304050607080910cafebabe01020304050607080910cafebabe01"
  ],
  "dispute_id": "dispute:mem-tamper-2026-003",
  "timestamp": "2026-04-10T17:30:00Z",
  "composite_sig": {
    "classical": { "alg": "ed25519", "kid": "a1b2c3d4e5f6a1b2c3d4e5f6a1b2c3d4", "sig_b64": "dGVzdHNpZzEyMzQ1Njc4OTAxMjM0NTY=" },
    "pq": { "alg": "ml-dsa-65", "kid": "d4e5f6a1b2c3d4e5f6a1b2c3d4e5f6a1", "sig_b64": "dGVzdHBxc2lnMTIzNDU2Nzg5MDEyMzQ1Ng==" },
    "binding": "pq_over_classical"
  }
}
